{
  "schemaVersion": "1.0.0",
  "exportedAt": "2026-04-16T14:46:16.676Z",
  "generator": "callstack/0.6.1",
  "project": {
    "name": "Sample",
    "description": null
  },
  "folders": [
    {
      "_ref": "folder-0",
      "name": "Auth"
    },
    {
      "_ref": "folder-1",
      "name": "Health"
    },
    {
      "_ref": "folder-2",
      "name": "Products"
    },
    {
      "_ref": "folder-3",
      "name": "Users"
    }
  ],
  "requests": [
    {
      "_ref": "req-0",
      "folderRef": "folder-3",
      "name": "Update User Profile",
      "method": "PATCH",
      "url": "{{baseUrl}}/api/users/me",
      "params": [],
      "headers": [
        {
          "key": "Content-Type",
          "value": "application/json",
          "enabled": true
        },
        {
          "key": "Authorization",
          "value": "Bearer {{authToken}}",
          "enabled": true
        }
      ],
      "body": "{\n  \"name\": \"Jane Doe\",\n  \"preferences\": {\n    \"theme\": \"dark\",\n    \"notifications\": true\n  }\n}",
      "preScript": "",
      "postScript": "if (response.status === 200) {\n  console.log('Profile updated');\n} else {\n  throw new Error(`Profile update failed: ${response.status}`);\n}",
      "position": 1,
      "attachments": []
    },
    {
      "_ref": "req-1",
      "folderRef": "folder-3",
      "name": "Get Current User",
      "method": "GET",
      "url": "{{baseUrl}}/api/users/me",
      "params": [],
      "headers": [
        {
          "key": "Authorization",
          "value": "Bearer {{authToken}}",
          "enabled": true
        }
      ],
      "body": "",
      "preScript": "",
      "postScript": "if (response.status === 200) {\n  const body = response.json();\n  console.log(`Logged in as: ${body.name} (${body.email})`);\n} else if (response.status === 401) {\n  throw new Error('Not authenticated — run Login first');\n}",
      "position": 0,
      "attachments": []
    },
    {
      "_ref": "req-2",
      "folderRef": "folder-2",
      "name": "Search Products",
      "method": "GET",
      "url": "{{baseUrl}}/api/products/search",
      "params": [
        {
          "key": "q",
          "value": "widget",
          "enabled": true
        },
        {
          "key": "minPrice",
          "value": "10",
          "enabled": true
        },
        {
          "key": "maxPrice",
          "value": "500",
          "enabled": true
        },
        {
          "key": "sort",
          "value": "price:asc",
          "enabled": true
        }
      ],
      "headers": [
        {
          "key": "Authorization",
          "value": "Bearer {{authToken}}",
          "enabled": true
        }
      ],
      "body": "",
      "preScript": "",
      "postScript": "const body = response.json;\n",
      "position": 6,
      "attachments": []
    },
    {
      "_ref": "req-3",
      "folderRef": "folder-2",
      "name": "Delete Product",
      "method": "DELETE",
      "url": "{{baseUrl}}/api/products/{{productId}}",
      "params": [],
      "headers": [
        {
          "key": "Authorization",
          "value": "Bearer {{authToken}}",
          "enabled": true
        }
      ],
      "body": "",
      "preScript": "console.log(`Deleting product #${env.productId}`);",
      "postScript": "if (response.status === 204 || response.status === 200) {\n  console.log('Product deleted successfully');\n} else if (response.status === 404) {\n  console.log('Product already deleted or not found');\n} else {\n  throw new Error(`Delete failed: ${response.status}`);\n}",
      "position": 5,
      "attachments": []
    },
    {
      "_ref": "req-4",
      "folderRef": "folder-2",
      "name": "Patch Product Price",
      "method": "PATCH",
      "url": "{{baseUrl}}/api/products/{{productId}}",
      "params": [],
      "headers": [
        {
          "key": "Content-Type",
          "value": "application/json",
          "enabled": true
        },
        {
          "key": "Authorization",
          "value": "Bearer {{authToken}}",
          "enabled": true
        }
      ],
      "body": "{\n  \"price\": 19.99,\n  \"active\": false\n}",
      "preScript": "",
      "postScript": "if (response.status === 200) {\n  const body = response.json();\n  console.log(`Patched product — new price: $${body.price}`);\n} else {\n  throw new Error(`Patch failed: ${response.status}`);\n}",
      "position": 4,
      "attachments": []
    },
    {
      "_ref": "req-5",
      "folderRef": "folder-2",
      "name": "Update Product",
      "method": "PUT",
      "url": "{{baseUrl}}/api/products/{{productId}}",
      "params": [],
      "headers": [
        {
          "key": "Content-Type",
          "value": "application/json",
          "enabled": true
        },
        {
          "key": "Authorization",
          "value": "Bearer {{authToken}}",
          "enabled": true
        }
      ],
      "body": "{\n  \"name\": \"Updated Widget\",\n  \"price\": 29.99,\n  \"active\": true,\n  \"category\": \"electronics\",\n  \"tags\": [\"updated\", \"sale\"]\n}",
      "preScript": "",
      "postScript": "if (response.status === 200) {\n  const body = response.json();\n  console.log(`Updated product #${body.id}`);\n} else if (response.status === 404) {\n  throw new Error('Product not found — cannot update');\n} else {\n  throw new Error(`Update failed: ${response.status}`);\n}",
      "position": 3,
      "attachments": []
    },
    {
      "_ref": "req-6",
      "folderRef": "folder-2",
      "name": "Create Product",
      "method": "POST",
      "url": "{{baseUrl}}/api/products",
      "params": [],
      "headers": [
        {
          "key": "Content-Type",
          "value": "application/json",
          "enabled": true
        },
        {
          "key": "Authorization",
          "value": "Bearer {{authToken}}",
          "enabled": true
        }
      ],
      "body": "{\n  \"name\": \"{{cName}}\",\n  \"price\": {{cPrice}},\n  \"active\": {{cActive}},\n  \"category\": \"electronics\",\n  \"tags\": [\"new\", \"featured\"]\n}",
      "preScript": "// Log what we're about to create\nconsole.log(`Creating product: ${env.cName || 'New Product'}`);",
      "postScript": "const body = response.json();\n\nif (response.status === 201) {\n  emit('productId', String(body.id));\n  console.log(`Created product #${body.id}: ${body.name}`);\n} else if (response.status === 409) {\n  console.log(`Product already exists: ${body.message}`);\n} else {\n  throw new Error(`Create failed: ${response.status} — ${JSON.stringify(body)}`);\n}",
      "position": 2,
      "attachments": []
    },
    {
      "_ref": "req-7",
      "folderRef": "folder-2",
      "name": "Get Product by ID",
      "method": "GET",
      "url": "{{baseUrl}}/api/products/{{productId}}",
      "params": [],
      "headers": [
        {
          "key": "Authorization",
          "value": "Bearer {{authToken}}",
          "enabled": true
        }
      ],
      "body": "",
      "preScript": "",
      "postScript": "const body = response.json();\n\nif (response.status === 200) {\n  emit('productName', body.name);\n  emit('productPrice', String(body.price));\n  console.log(`Product: ${body.name} — $${body.price}`);\n} else if (response.status === 404) {\n  console.log('Product not found');\n} else {\n  throw new Error(`Unexpected status: ${response.status}`);\n}",
      "position": 1,
      "attachments": []
    },
    {
      "_ref": "req-8",
      "folderRef": "folder-2",
      "name": "List Products",
      "method": "GET",
      "url": "{{baseUrl}}/api/products",
      "params": [
        {
          "key": "page",
          "value": "1",
          "enabled": true
        },
        {
          "key": "limit",
          "value": "20",
          "enabled": true
        },
        {
          "key": "active",
          "value": "true",
          "enabled": false
        }
      ],
      "headers": [
        {
          "key": "Authorization",
          "value": "Bearer {{authToken}}",
          "enabled": true
        }
      ],
      "body": "",
      "preScript": "",
      "postScript": "// Validate list response\nconst body = response.json();\n\nif (response.status !== 200) {\n  throw new Error(`List products failed: ${response.status}`);\n}\n\nif (!Array.isArray(body.data)) {\n  throw new Error('Expected data array in response');\n}\n\nconsole.log(`Got ${body.data.length} products (total: ${body.total})`);",
      "position": 0,
      "attachments": []
    },
    {
      "_ref": "req-9",
      "folderRef": "folder-0",
      "name": "Refresh Token",
      "method": "POST",
      "url": "{{baseUrl}}/auth/refresh",
      "params": [],
      "headers": [
        {
          "key": "Authorization",
          "value": "Bearer {{authToken}}",
          "enabled": true
        }
      ],
      "body": "",
      "preScript": "",
      "postScript": "if (response.status === 200) {\n  const body = response.json();\n  emit('authToken', body.token);\n  console.log('Token refreshed');\n}",
      "position": 1,
      "attachments": []
    },
    {
      "_ref": "req-10",
      "folderRef": "folder-0",
      "name": "Login",
      "method": "POST",
      "url": "{{baseUrl}}/auth/login",
      "params": [],
      "headers": [
        {
          "key": "Content-Type",
          "value": "application/json",
          "enabled": true
        }
      ],
      "body": "{\n  \"email\": \"admin@example.com\",\n  \"password\": \"{{password}}\",\n  \"requestId\": \"{{$guid}}\"\n}",
      "preScript": "// Log which environment we're hitting\nconsole.log(`Logging in to: ${env.baseUrl}`);",
      "postScript": "// Extract and store the auth token\nconst body = response.json();\n\nif (response.status === 200 && body.token) {\n  emit('authToken', body.token);\n  emit('userId', body.user.id);\n  console.log('Login successful, token stored');\n} else {\n  throw new Error(`Login failed: ${response.status} — ${body.message}`);\n}",